{
  "term": "Waza-ari",
  "kanji": "技あり",
  "category": "scoring",
  "meaning": {
    "en": "A half point in everything but name: a throw missing one of the elements of ippon, or a hold of ten to nineteen seconds. Two of them make ippon and end the contest, and nothing smaller ever adds up to one."
  },
  "guides": [
    "competition-rules-basics"
  ]
}
