{
  "term": "Ippon",
  "kanji": "一本",
  "category": "scoring",
  "meaning": {
    "en": "One full point, and the end of the contest. Awarded for a throw largely on the back with control, speed and force, a twenty-second hold-down, or a submission."
  },
  "guides": [
    "competition-rules-basics"
  ]
}
